{
  "schema_version": 1,
  "environment": "预发后台",
  "boundary": "验证环境=预发后台；未覆盖：真机/收信端",
  "version_stamp": {
    "captured_at": "2026-08-04T10:35:05.889Z",
    "staging_url": "https://staging-autopilot.zenjoymedia.media",
    "backend_sha": "unknown(健康端点未暴露构建号)",
    "apk_expected": "2.1.19"
  },
  "run": {
    "trigger": "manual",
    "operator": "AI员工采证器"
  },
  "cells": [
    {
      "id": "S1-c3",
      "verdict": "通过",
      "criteria": "用的是本轮发的测试授权码，绑进的是预发环境",
      "symptoms": [],
      "reasons": [
        "注册在带STAGING角标的预发域名完成并获得登录态（02-after-signup.png：工作台已登录为AI验收员）"
      ],
      "evidence": [
        "evidence/S1-c3/01-signup-page.page.txt",
        "evidence/S1-c3/01-signup-page.png",
        "evidence/S1-c3/02-after-signup.page.txt",
        "evidence/S1-c3/02-after-signup.png"
      ],
      "note": "注册页（预发域名可见）；注册提交后（账号 ai-table-1785839361704@zenithjoy.test）"
    },
    {
      "id": "S4-c2",
      "verdict": "无法验证",
      "criteria": "在约定时间窗内恢复在线，不是等半天才连上",
      "symptoms": [],
      "reasons": [
        "该租户无绑定设备（账号页0/10空态），重启恢复时间窗场景不存在"
      ],
      "evidence": [
        "evidence/S4-c2/01-accounts.page.txt",
        "evidence/S4-c2/01-accounts.png"
      ],
      "scenario_required": true,
      "note": "设备与账号状态页"
    },
    {
      "id": "S4-c3",
      "verdict": "无法验证",
      "criteria": "后台看到在线的确实是这台测试机",
      "symptoms": [],
      "reasons": [
        "无设备可对照「确实是这台测试机」"
      ],
      "evidence": [
        "evidence/S4-c3/01-accounts.page.txt",
        "evidence/S4-c3/01-accounts.png"
      ],
      "scenario_required": true,
      "note": "设备与账号状态页"
    },
    {
      "id": "S5-c3",
      "verdict": "无法验证",
      "criteria": "掉线的小号不再显示「可用」",
      "symptoms": [],
      "reasons": [
        "无小号（空态），掉线场景不存在；空态下未见「掉线仍标可用」假象"
      ],
      "evidence": [
        "evidence/S5-c3/01-accounts.page.txt",
        "evidence/S5-c3/01-accounts.png"
      ],
      "scenario_required": true,
      "note": "设备与账号状态页"
    },
    {
      "id": "S5-c4",
      "verdict": "无法验证",
      "criteria": "红线9/10：掉线号不被强行派任务；一个小号出问题不连坐其它小号",
      "symptoms": [],
      "reasons": [
        "掉线派单/连坐场景不存在"
      ],
      "evidence": [
        "evidence/S5-c4/01-accounts.page.txt",
        "evidence/S5-c4/01-accounts.png"
      ],
      "scenario_required": true,
      "note": "设备与账号状态页"
    },
    {
      "id": "S6-c3",
      "verdict": "无法验证",
      "criteria": "任务记录绑定的是正确的客户账号、这台手机、本轮关键词（红线2）",
      "symptoms": [],
      "reasons": [
        "无在线机器无法发起采集；产品以红色横幅明确给出禁用原因（01-collect-fail.png），失败语义良好非缺陷；需用已绑设备的常驻测试租户重跑"
      ],
      "evidence": [
        "evidence/S6-c3/01-collect-fail.page.txt",
        "evidence/S6-c3/01-collect-fail.png"
      ],
      "note": "发起采集交互失败: locator.click: Timeout 5000ms exceeded.\nCall log:\n\u001b[2m  - waiting for locator('button:has-text(\"开始采集\")').first()\u001b[22m\n\u001b[2m    - locator resolved to <button disabled type=\"button\" class=\"flex items-center gap-1 rounded bg-emerald-600 px-4 py-2 text-white text-sm disabled:bg-gray-300 dark:disabled:bg-slate-700\">…</button>\u001b[22m\n\u001b[2m  - attempting click action\u001b[22m\n\u001b[2m    2 × waiting for element to be visible, enabled and stable\u001b[22m\n\u001b[2m      - element is not enabled\u001b[22m\n\u001b[2m    - retrying click action\u001b[22m\n\u001b[2m    - waiting 20ms\u001b[22m\n\u001b[2m    2 × waiting for element to be visible, enabled and stable\u001b[22m\n\u001b[2m      - element is not enabled\u001b[22m\n\u001b[2m    - retrying click action\u001b[22m\n\u001b[2m      - waiting 100ms\u001b[22m\n\u001b[2m    10 × waiting for element to be visible, enabled and stable\u001b[22m\n\u001b[2m       - element is not enabled\u001b[22m\n\u001b[2m     - retrying click action\u001b[22m\n\u001b[2m       - waiting 500ms\u001b[22m\n；发起采集失败现场"
    },
    {
      "id": "S6-c4",
      "verdict": "通过",
      "criteria": "红线3：不能碰到别的客户的数据",
      "symptoms": [],
      "reasons": [
        "新账号任务列表与历史任务为空，未出现任何他租户数据（01-tasks-initial.png）；证据为直接观察，强度受限于零数据"
      ],
      "evidence": [
        "evidence/S6-c4/01-tasks-initial.page.txt",
        "evidence/S6-c4/01-tasks-initial.png"
      ],
      "note": "新账号任务列表初始状态（归属隔离证据）"
    },
    {
      "id": "S7-c1",
      "verdict": "无法验证",
      "criteria": "任务有明确结果不卡死；失败时有具体原因，不是笼统「未知错误」",
      "symptoms": [],
      "reasons": [
        "无采集任务可观察（前置被无设备卡住），5分钟轮询序列在案"
      ],
      "evidence": [
        "evidence/S7-c1/poll-01.page.txt",
        "evidence/S7-c1/poll-02.page.txt",
        "evidence/S7-c1/poll-03.page.txt",
        "evidence/S7-c1/poll-04.page.txt",
        "evidence/S7-c1/poll-05.page.txt",
        "evidence/S7-c1/poll-05.png"
      ],
      "note": "第1次轮询（3秒）；第2次轮询（66秒）；第3次轮询（129秒）；第4次轮询（192秒）；第5次轮询（255秒）"
    },
    {
      "id": "S7-c2",
      "verdict": "无法验证",
      "criteria": "5分钟内进入终态",
      "symptoms": [],
      "reasons": [
        "同S7-c1"
      ],
      "evidence": [
        "evidence/S7-c2/poll-01.page.txt",
        "evidence/S7-c2/poll-02.page.txt",
        "evidence/S7-c2/poll-03.page.txt",
        "evidence/S7-c2/poll-04.page.txt",
        "evidence/S7-c2/poll-05.page.txt",
        "evidence/S7-c2/poll-05.png"
      ],
      "note": "第1次轮询（3秒）；第2次轮询（66秒）；第3次轮询（129秒）；第4次轮询（192秒）；第5次轮询（255秒）"
    },
    {
      "id": "S8-c1",
      "verdict": "无法验证",
      "criteria": "至少采到2条真实存在的抖音视频",
      "symptoms": [],
      "reasons": [
        "无任务故无视频列表"
      ],
      "evidence": [
        "evidence/S8-c1/poll-01.page.txt",
        "evidence/S8-c1/poll-02.page.txt",
        "evidence/S8-c1/poll-03.page.txt",
        "evidence/S8-c1/poll-04.page.txt",
        "evidence/S8-c1/poll-05.page.txt",
        "evidence/S8-c1/poll-05.png"
      ],
      "note": "第1次轮询（3秒）；第2次轮询（66秒）；第3次轮询（129秒）；第4次轮询（192秒）；第5次轮询（255秒）"
    },
    {
      "id": "S8-c3",
      "verdict": "无法验证",
      "criteria": "视频编号是真实长编号（15位以上）",
      "symptoms": [],
      "reasons": [
        "同S8-c1"
      ],
      "evidence": [
        "evidence/S8-c3/poll-01.page.txt",
        "evidence/S8-c3/poll-02.page.txt",
        "evidence/S8-c3/poll-03.page.txt",
        "evidence/S8-c3/poll-04.page.txt",
        "evidence/S8-c3/poll-05.page.txt",
        "evidence/S8-c3/poll-05.png"
      ],
      "note": "第1次轮询（3秒）；第2次轮询（66秒）；第3次轮询（129秒）；第4次轮询（192秒）；第5次轮询（255秒）"
    },
    {
      "id": "S8-c4",
      "verdict": "无法验证",
      "criteria": "红线4：禁止本地随手生成的假编号",
      "symptoms": [],
      "reasons": [
        "同S8-c1"
      ],
      "evidence": [
        "evidence/S8-c4/poll-01.page.txt",
        "evidence/S8-c4/poll-02.page.txt",
        "evidence/S8-c4/poll-03.page.txt",
        "evidence/S8-c4/poll-04.page.txt",
        "evidence/S8-c4/poll-05.page.txt",
        "evidence/S8-c4/poll-05.png"
      ],
      "note": "第1次轮询（3秒）；第2次轮询（66秒）；第3次轮询（129秒）；第4次轮询（192秒）；第5次轮询（255秒）"
    },
    {
      "id": "S9-c1",
      "verdict": "无法验证",
      "criteria": "至少1条视频判出结果，不永远卡在「判定中」",
      "symptoms": [],
      "reasons": [
        "无任务故无判定列"
      ],
      "evidence": [
        "evidence/S9-c1/poll-01.page.txt",
        "evidence/S9-c1/poll-02.page.txt",
        "evidence/S9-c1/poll-03.page.txt",
        "evidence/S9-c1/poll-04.page.txt",
        "evidence/S9-c1/poll-05.page.txt",
        "evidence/S9-c1/poll-05.png"
      ],
      "note": "第1次轮询（3秒）；第2次轮询（66秒）；第3次轮询（129秒）；第4次轮询（192秒）；第5次轮询（255秒）"
    },
    {
      "id": "S9-c2",
      "verdict": "无法验证",
      "criteria": "3分钟内出结果",
      "symptoms": [],
      "reasons": [
        "同S9-c1"
      ],
      "evidence": [
        "evidence/S9-c2/poll-01.page.txt",
        "evidence/S9-c2/poll-02.page.txt",
        "evidence/S9-c2/poll-03.page.txt",
        "evidence/S9-c2/poll-04.page.txt",
        "evidence/S9-c2/poll-05.page.txt",
        "evidence/S9-c2/poll-05.png"
      ],
      "note": "第1次轮询（3秒）；第2次轮询（66秒）；第3次轮询（129秒）；第4次轮询（192秒）；第5次轮询（255秒）"
    },
    {
      "id": "S10-c1",
      "verdict": "无法验证",
      "criteria": "产出真实线索：昵称、评论、目标身份都能核实",
      "symptoms": [],
      "reasons": [
        "线索页为空（本轮无采集产出），页面文本仅含本租户视图"
      ],
      "evidence": [
        "evidence/S10-c1/01-leads.page.txt",
        "evidence/S10-c1/01-leads.png"
      ],
      "note": "线索列表页"
    },
    {
      "id": "S10-c4",
      "verdict": "无法验证",
      "criteria": "红线11：旧评论数据不能覆盖新的",
      "symptoms": [],
      "reasons": [
        "覆盖场景需两轮数据对照，本轮无数据"
      ],
      "evidence": [
        "evidence/S10-c4/01-leads.page.txt",
        "evidence/S10-c4/01-leads.png"
      ],
      "scenario_required": true,
      "note": "线索列表页"
    },
    {
      "id": "S11-c1",
      "verdict": "无法验证",
      "criteria": "派单目标来自本轮真实产生的线索，不是人工填的固定数据",
      "symptoms": [],
      "reasons": [
        "触达记录页为空，无派单可核"
      ],
      "evidence": [
        "evidence/S11-c1/01-outreach.page.txt",
        "evidence/S11-c1/01-outreach.png"
      ],
      "note": "私信派单页"
    },
    {
      "id": "S11-c3",
      "verdict": "无法验证",
      "criteria": "客户账号、任务、线索、派单串成同一条链（红线2）",
      "symptoms": [],
      "reasons": [
        "同S11-c1"
      ],
      "evidence": [
        "evidence/S11-c3/01-outreach.page.txt",
        "evidence/S11-c3/01-outreach.png"
      ],
      "note": "私信派单页"
    },
    {
      "id": "S11-c4",
      "verdict": "通过",
      "criteria": "红线3：不能触达其他客户的数据",
      "symptoms": [],
      "reasons": [
        "触达记录页未出现任何他租户数据（01-outreach.png），同S6-c4口径"
      ],
      "evidence": [
        "evidence/S11-c4/01-outreach.page.txt",
        "evidence/S11-c4/01-outreach.png"
      ],
      "note": "私信派单页"
    },
    {
      "id": "S13-c4",
      "verdict": "无法验证",
      "criteria": "红线8：「被频控限制」不能显示成「已私信」",
      "symptoms": [],
      "reasons": [
        "频控场景缺失，页面无「被限制/已私信」并存迹象可判"
      ],
      "evidence": [
        "evidence/S13-c4/01-outreach.page.txt",
        "evidence/S13-c4/01-outreach.png"
      ],
      "scenario_required": true,
      "note": "私信派单页"
    }
  ]
}